<?xml version="1.0" encoding="utf-8" ?>
<mapping xmlns:xsi="http://www.w3.org/2001/XMLSchema-instance"
         xsi:noNamespaceSchemaLocation="../../xsd/datasource_mapping.xsd">

    <mappedSheet number="0">
        <headerRow>0</headerRow>
        <retriever className="eu.profinit.opendata.transform.convert.PropertyBasedRecordRetriever">
            <sourceFileColumn originalName="CISLO" argumentName="authorityIdentifier"/>
        </retriever>
        <propertySet ref="all"/>
    </mappedSheet>

    <propertySet name="all">
        <property name="recordType" value="CONTRACT" onlyNewRecords="true"/>

        <property name="authorityRole" onlyNewRecords="true" value="CUSTOMER"/>

        <property name="authorityIdentifier" onlyNewRecords="true" converter="eu.profinit.opendata.transform.convert.DirectStringSetter">
            <sourceFileColumn originalName="CISLO" argumentName="inputString"/>
        </property>

        <property name="partner" onlyNewRecords="true"
                  converter="eu.profinit.opendata.transform.convert.PartnerSetter">
            <sourceFileColumn originalName="DODAVATEL" argumentName="name"/>
            <sourceFileColumn originalName="ICDOD" argumentName="ico"/>
        </property>

        <property name="subject" onlyNewRecords="false" converter="eu.profinit.opendata.transform.convert.DirectStringSetter">
            <sourceFileColumn originalName="PREDMET" argumentName="inputString"/>
        </property>

        <property name="currency" onlyNewRecords="true" value="CZK"/>

        <property name="allAmounts" onlyNewRecords="false" converter="eu.profinit.opendata.transform.convert.AllAmountSetter">
            <sourceFileColumn originalName="CENA" argumentName="inputAmount"/>
        </property>

        <property name="dateCreated" onlyNewRecords="false" converter="eu.profinit.opendata.transform.convert.mdcr.MDDateCreatedSetter">
            <sourceFileColumn originalName="PLATOD" argumentName="dateFrom"/>
            <sourceFileColumn originalName="DATUCIN" argumentName="dateInEffect"/>
            <sourceFileColumn originalName="DATPOD" argumentName="dateSubmitted"/>
            <sourceFileColumn originalName="CISLO" argumentName="authorityIdentifier"/>
        </property>

        <property name="dateOfExpiry" onlyNewRecords="false" converter="eu.profinit.opendata.transform.convert.DateSetter">
            <sourceFileColumn originalName="PLATDO" argumentName="inputDate"/>
        </property>

        <property name="masterId" onlyNewRecords="true" converter="eu.profinit.opendata.transform.convert.RandomMasterIdSetter">

        </property>
    </propertySet>
</mapping>