<?xml version="1.0" encoding="utf-8" ?>
<mapping xmlns:xsi="http://www.w3.org/2001/XMLSchema-instance"
         xsi:noNamespaceSchemaLocation="../../../xsd/datasource_mapping.xsd">

    <mappedSheet number="0">
        <headerRow>0</headerRow>
        <retriever className="eu.profinit.opendata.transform.convert.mmr.czt.CZTInvoiceRetriever">
            <sourceFileColumn originalName="Rok" argumentName="inputYear"/>
            <sourceFileColumn originalName="Dokladová řada" argumentName="categoryCode"/>
            <sourceFileColumn originalName="Číslo dokladu" argumentName="serialNumber"/>
        </retriever>

        <property name="recordType" value="INVOICE" onlyNewRecords="true"/>

        <property name="authorityRole" onlyNewRecords="true" value="CUSTOMER"/>

        <property name="authorityIdentifier" onlyNewRecords="true"
                  converter="eu.profinit.opendata.transform.convert.TripleSplitIdentifierSetter">
            <sourceFileColumn originalName="Rok" argumentName="inputYear"/>
            <sourceFileColumn originalName="Dokladová řada" argumentName="categoryCode"/>
            <sourceFileColumn originalName="Číslo dokladu" argumentName="serialNumber"/>
        </property>

        <property name="partner" onlyNewRecords="true"
                  converter="eu.profinit.opendata.transform.convert.PartnerSetter">
            <sourceFileColumn originalName="Osoba" argumentName="name"/>
        </property>

        <property name="currency" onlyNewRecords="true" converter="eu.profinit.opendata.transform.convert.CurrencySetter">
            <sourceFileColumn originalName="Měna" argumentName="inputCurrencyCode"/>
        </property>

        <property name="subject" onlyNewRecords="true" converter="eu.profinit.opendata.transform.convert.mmr.czt.DirectStringSemicolonTrimSetter">
            <sourceFileColumn originalName="Popis" argumentName="inputString"/>
            <sourceFileColumn originalName="Popis;" argumentName="inputString"/>
        </property>

        <property name="allAmounts" onlyNewRecords="true" converter="eu.profinit.opendata.transform.convert.AllAmountSetter">
            <sourceFileColumn originalName="Částka" argumentName="inputAmount"/>
        </property>

        <property name="dateCreated" required="false" onlyNewRecords="true" converter="eu.profinit.opendata.transform.convert.UniversalDateSetter">
            <sourceFileColumn originalName="Datum příchodu" argumentName="inputDateString"/>
        </property>

        <property name="dateOfPayment" required="false" onlyNewRecords="true" converter="eu.profinit.opendata.transform.convert.UniversalDateSetter">
            <sourceFileColumn originalName="Datum úhrady" argumentName="inputDateString"/>
        </property>

        <property name="masterId" onlyNewRecords="true" converter="eu.profinit.opendata.transform.convert.RandomMasterIdSetter"/>

    </mappedSheet>
</mapping>