<?xml version="1.0" encoding="utf-8" ?>
<mapping xmlns:xsi="http://www.w3.org/2001/XMLSchema-instance"
         xsi:noNamespaceSchemaLocation="../../xsd/datasource_mapping.xsd">

    <mappedSheet number="0">
        <headerRow>0</headerRow>

        <retriever className="eu.profinit.opendata.transform.convert.PropertyBasedRecordRetriever">
            <sourceFileColumn originalName="id" argumentName="authorityIdentifier"/>
        </retriever>

        <property name="recordType" value="INVOICE" onlyNewRecords="true"/>

        <property name="authorityRole" onlyNewRecords="true" value="CUSTOMER"/>

        <property name="authorityIdentifier" onlyNewRecords="true" converter="eu.profinit.opendata.transform.convert.DirectStringSetter">
            <sourceFileColumn originalName="id" argumentName="inputString"/>
        </property>

        <property name="partner" onlyNewRecords="true"
                  converter="eu.profinit.opendata.transform.convert.PartnerSetter">
            <sourceFileColumn originalName="dodavatel_název" argumentName="name"/>
            <sourceFileColumn originalName="dodavatel_ičo" argumentName="ico"/>
        </property>

        <property name="subject" onlyNewRecords="true" converter="eu.profinit.opendata.transform.convert.DirectStringSetter">
            <sourceFileColumn originalName="účel_platby" argumentName="inputString"/>
        </property>

        <property name="budgetCategory" onlyNewRecords="false" converter="eu.profinit.opendata.transform.convert.BudgetCategoryAppender">
            <sourceFileColumn originalName="kapitola_rozpočtu" argumentName="category"/>
        </property>

        <property name="currency" onlyNewRecords="true" value="CZK"/>

        <property name="allAmounts" onlyNewRecords="true" converter="eu.profinit.opendata.transform.convert.AllAmountSetter">
            <sourceFileColumn originalName="částka_s_dph" argumentName="inputAmount"/>
        </property>

        <property name="amountCzk" onlyNewRecords="true" converter="eu.profinit.opendata.transform.convert.CZKAmountSetter">
            <sourceFileColumn originalName="částka_s_dph" argumentName="inputAmount"/>
        </property>

        <property name="dateCreated" onlyNewRecords="true" converter="eu.profinit.opendata.transform.convert.UniversalDateSetter">
            <sourceFileColumn originalName="datum_přijetí" argumentName="inputDateString"/>
        </property>

        <property name="dueDate" onlyNewRecords="true" converter="eu.profinit.opendata.transform.convert.UniversalDateSetter">
            <sourceFileColumn originalName="datum_splatnosti" argumentName="inputDateString"/>
        </property>

        <property name="dateOfPayment" onlyNewRecords="true" converter="eu.profinit.opendata.transform.convert.UniversalDateSetter">
            <sourceFileColumn originalName="datum_úhrady" argumentName="inputDateString"/>
        </property>

        <property name="masterId" onlyNewRecords="true" converter="eu.profinit.opendata.transform.convert.RandomMasterIdSetter"/>

    </mappedSheet>
</mapping>