<?xml version="1.0" encoding="utf-8" ?>
<mapping xmlns:xsi="http://www.w3.org/2001/XMLSchema-instance"
         xsi:noNamespaceSchemaLocation="../../xsd/datasource_mapping.xsd">

    <mappedSheet number="0">
        <headerRow>1</headerRow>

        <retriever className="eu.profinit.opendata.transform.convert.justice.JusticeInvoiceRecordRetriever">
            <sourceFileColumn originalName="Rok" argumentName="inputYear"/>
            <sourceFileColumn originalName="Dokladová řada" argumentName="categoryCode"/>
            <sourceFileColumn originalName="Číslo" argumentName="serialNumber"/>
        </retriever>

        <property name="recordType" value="INVOICE" onlyNewRecords="true"/>

        <property name="authorityIdentifier" onlyNewRecords="true" converter="eu.profinit.opendata.transform.convert.TripleSplitIdentifierSetter">
            <sourceFileColumn originalName="Rok" argumentName="inputYear"/>
            <sourceFileColumn originalName="Dokladová řada" argumentName="categoryCode"/>
            <sourceFileColumn originalName="Číslo" argumentName="serialNumber"/>
        </property>

        <property name="authorityRole" value="CUSTOMER" onlyNewRecords="true"/>

        <property name="partner" onlyNewRecords="true"
                  converter="eu.profinit.opendata.transform.convert.PartnerSetter">
            <sourceFileColumn originalName="IČ" argumentName="ico"/>
            <sourceFileColumn originalName="Osoba" argumentName="name"/>
        </property>

        <property name="subject" onlyNewRecords="true" converter="eu.profinit.opendata.transform.convert.DirectStringSetter">
            <sourceFileColumn originalName="Důvod úhrady" argumentName="inputString"/>
            <sourceFileColumn originalName="PARAMETR4" argumentName="inputString"/>
        </property>

        <property name="variableSymbol" onlyNewRecords="true" converter="eu.profinit.opendata.transform.convert.DirectStringSetter">
            <sourceFileColumn originalName="Variabilní symbol" argumentName="inputString"/>
        </property>


        <property name="currency" onlyNewRecords="true" converter="eu.profinit.opendata.transform.convert.CurrencySetter">
            <sourceFileColumn originalName="Měna" argumentName="inputCurrencyCode"/>
        </property>

        <property name="allAmounts" onlyNewRecords="true" converter="eu.profinit.opendata.transform.convert.AllAmountSetter">
            <sourceFileColumn originalName="Částka" argumentName="inputAmount"/>
        </property>

        <property name="dateCreated" onlyNewRecords="true" converter="eu.profinit.opendata.transform.convert.DateSetter">
            <sourceFileColumn originalName="Zapsáno" argumentName="inputDate"/>
        </property>

        <property name="dueDate" onlyNewRecords="true" converter="eu.profinit.opendata.transform.convert.DateSetter">
            <sourceFileColumn originalName="Splatnost" argumentName="inputDate"/>
        </property>

        <property name="dateOfPayment" onlyNewRecords="true" converter="eu.profinit.opendata.transform.convert.DateSetter">
            <sourceFileColumn originalName="Uhrazeno" argumentName="inputDate"/>
        </property>

        <property name="masterId" onlyNewRecords="true" converter="eu.profinit.opendata.transform.convert.RandomMasterIdSetter">

        </property>
    </mappedSheet>
</mapping>