<?xml version="1.0" encoding="utf-8" ?>
<mapping xmlns:xsi="http://www.w3.org/2001/XMLSchema-instance"
         xsi:noNamespaceSchemaLocation="../../xsd/datasource_mapping.xsd">

    <headerRow>0</headerRow>

    <retriever className="eu.profinit.opendata.transform.convert.PropertyBasedRecordRetriever">
        <sourceFileColumn originalName="[CISLO]" argumentName="inputAuthorityIdentifier"/>
    </retriever>

    <property name="recordType" value="INVOICE" onlyNewRecords="true"/>

    <property name="subject" onlyNewRecords="false" converter="eu.profinit.opendata.transform.convert.SubjectAppender">
        <sourceFileColumn originalName="[UCELPLATBY]" argumentName="mainSubject"/>
        <sourceFileColumn originalName="[NAZEVPOLOZKAROZPOCTU]" argumentName="lineSubject"/>
    </property>

    <property name="currency" onlyNewRecords="true" converter="eu.profinit.opendata.transform.convert.CurrencySetter">
        <sourceFileColumn originalName="[MENA]" argumentName="inputCurrencyCode"/>
    </property>

    <property name="originalCurrencyAmount" onlyNewRecords="true" converter="eu.profinit.opendata.transform.convert.DirectMoneySetter">
        <sourceFileColumn originalName="[CELKOVACASTKACIZIMENA]" argumentName="inputAmount"/>
    </property>

    <property name="amountCzkWithoutVat" onlyNewRecords="true" converter="eu.profinit.opendata.transform.convert.CZKAmountSetter">
        <sourceFileColumn originalName="[CELKOVACASTKABEZDPH]" argumentName="inputAmount"/>
    </property>

    <property name="amountCzkWithVat" onlyNewRecords="true" converter="eu.profinit.opendata.transform.convert.CZKAmountSetter">
        <sourceFileColumn originalName="[CELKOVACASTKA]" argumentName="inputAmount"/>
    </property>

    <property name="authorityIdentifier" onlyNewRecords="true" converter="eu.profinit.opendata.transform.convert.DirectStringSetter">
        <sourceFileColumn originalName="[CISLO]" argumentName="inputString"/>
    </property>

    <property name="partner" onlyNewRecords="true" converter="eu.profinit.opendata.transform.convert.PartnerSetter">
        <sourceFileColumn originalName="[DODAVATEL]" argumentName="name"/>
        <sourceFileColumn originalName="[ICO]" argumentName="ico"/>
    </property>

    <property name="dateCreated" onlyNewRecords="true" converter="eu.profinit.opendata.transform.convert.DateSetter">
        <sourceFileColumn originalName="[DATUMVYSTAVENI]" argumentName="inputDateString"/>
    </property>

    <property name="dueDate" onlyNewRecords="true" converter="eu.profinit.opendata.transform.convert.DateSetter">
        <sourceFileColumn originalName="[DATUMSPLATNOSTI]" argumentName="inputDateString"/>
    </property>

    <property name="dateOfPayment" onlyNewRecords="true" converter="eu.profinit.opendata.transform.convert.DateSetter">
        <sourceFileColumn originalName="[DATUMUHRADY]" argumentName="inputDateString"/>
    </property>

</mapping>