<?xml version="1.0" encoding="utf-8" ?>
<mapping xmlns:xsi="http://www.w3.org/2001/XMLSchema-instance"
         xsi:noNamespaceSchemaLocation="../../xsd/datasource_mapping.xsd">

    <headerRow>1</headerRow>

    <property name="recordType" value="CONTRACT" onlyNewRecords="true"/>

    <retriever className="eu.profinit.opendata.transform.convert.PropertyBasedRecordRetriever">
        <sourceFileColumn originalName="Číslo_smlouvy/dodatku" argumentName="authorityIdentifier"/>
    </retriever>

    <property name="authorityRole" onlyNewRecords="true" 
              converter="eu.profinit.opendata.transform.convert.mfcr.ContractRoleConverter">
        <sourceFileColumn originalName="Povaha_smlouvy" argumentName="role"/>
    </property>

    <property name="authorityIdentifier" onlyNewRecords="true" converter="eu.profinit.opendata.transform.convert.DirectStringSetter">
        <sourceFileColumn originalName="Číslo_smlouvy/dodatku" argumentName="inputString"/>
    </property>

    <property name="partner" onlyNewRecords="true"
              converter="eu.profinit.opendata.transform.convert.PartnerSetter">
        <sourceFileColumn originalName="IČO" argumentName="ico"/>
        <sourceFileColumn originalName="Název_partnera" argumentName="name"/>
    </property>

    <property name="subject" onlyNewRecords="true" converter="eu.profinit.opendata.transform.convert.SubjectAppender">
        <sourceFileColumn originalName="Popis_smluvního_typu" argumentName="mainSubject"/>
        <sourceFileColumn originalName="Předmět" argumentName="lineSubject"/>
    </property>
    
    <property name="currency" onlyNewRecords="true" converter="eu.profinit.opendata.transform.convert.CurrencySetter">
        <sourceFileColumn originalName="Měna" argumentName="inputCurrencyCode"/>
    </property>

    <property name="originalCurrencyAmount" onlyNewRecords="false"
              converter="eu.profinit.opendata.transform.convert.mfcr.ContractAmountSetter">
        <sourceFileColumn originalName="Částka" argumentName="contractAmount"/>
        <sourceFileColumn originalName="Částka01" argumentName="invoiceAmount"/>
    </property>

    <property name="inEffect" onlyNewRecords="true" converter="eu.profinit.opendata.transform.convert.mfcr.ContractValiditySetter">
        <sourceFileColumn originalName="Kód_stavu" argumentName="validity"/>
    </property>

    <property name="dateCreated" onlyNewRecords="true" converter="eu.profinit.opendata.transform.convert.DateSetter">
        <sourceFileColumn originalName="Platnost_od" argumentName="inputDateString"/>
    </property>
    
    <property name="dateOfExpiry" onlyNewRecords="true" converter="eu.profinit.opendata.transform.convert.DateSetter">
        <sourceFileColumn originalName="Platnost_do" argumentName="inputDateString"/>
    </property>

    <property name="parentRecord" onlyNewRecords="true" converter="eu.profinit.opendata.transform.convert.mfcr.ContractParentSetter">
        <sourceFileColumn originalName="Typ_smlouvy" argumentName="type"/>
    </property>
    
    <property name="invoiceId" onlyNewRecords="false" converter="eu.profinit.opendata.transform.convert.mfcr.ContractAndInvoiceCorrelator">
        <sourceFileColumn originalName="Číslo_faktury" argumentName="invoiceId"/>
    </property>

    <property name="masterId" onlyNewRecords="true" converter="eu.profinit.opendata.transform.convert.RandomMasterIdSetter">

    </property>
</mapping>