<?xml version="1.0" encoding="utf-8" ?>
<mapping xmlns:xsi="http://www.w3.org/2001/XMLSchema-instance"
         xsi:noNamespaceSchemaLocation="../../xsd/datasource_mapping.xsd">

    <mappedSheet number="0">
        <headerRow>3</headerRow>

        <retriever className="eu.profinit.opendata.transform.convert.PropertyBasedRecordRetriever">
            <sourceFileColumn originalName="Číslo faktury" argumentName="authorityIdentifier"/>
        </retriever>

        <property name="recordType" value="INVOICE" onlyNewRecords="true"/>

        <property name="authorityRole" onlyNewRecords="true" value="CUSTOMER"/>

        <property name="authorityIdentifier" onlyNewRecords="true" converter="eu.profinit.opendata.transform.convert.DirectStringSetter">
            <sourceFileColumn originalName="Číslo faktury" argumentName="inputString"/>
        </property>

        <property name="partner" onlyNewRecords="true"
                  converter="eu.profinit.opendata.transform.convert.PartnerSetter">
            <sourceFileColumn originalName="Dodavatel" argumentName="name"/>
            <sourceFileColumn originalName="ICO" argumentName="ico"/>
        </property>

        <property name="subject" onlyNewRecords="true" converter="eu.profinit.opendata.transform.convert.DirectStringSetter">
            <sourceFileColumn originalName="Popis" argumentName="inputString"/>
        </property>

        <property name="currency" onlyNewRecords="true" value="CZK"/>

        <property name="allAmounts" onlyNewRecords="true" converter="eu.profinit.opendata.transform.convert.AllAmountSetter">
            <sourceFileColumn originalName="Celková částka" argumentName="inputAmount"/>
        </property>

        <property name="dateCreated" onlyNewRecords="true" converter="eu.profinit.opendata.transform.convert.mzp.MZPDateSetter">
            <sourceFileColumn originalName="Datum platby" argumentName="inputDate"/>
        </property>

        <property name="masterId" onlyNewRecords="true" converter="eu.profinit.opendata.transform.convert.RandomMasterIdSetter"/>

        <property name="contractId" onlyNewRecords="true" converter="eu.profinit.opendata.transform.convert.mzp.MZPCorrelator">
            <sourceFileColumn originalName="Číslo smlouvy" argumentName="contractId"/>
        </property>
    </mappedSheet>
</mapping>