<?xml version="1.0" encoding="utf-8" ?>
<mapping xmlns:xsi="http://www.w3.org/2001/XMLSchema-instance"
         xsi:noNamespaceSchemaLocation="../../../xsd/datasource_mapping.xsd">

    <mappedSheet number="0">
        <headerRow>3</headerRow>
        <retriever className="eu.profinit.opendata.transform.convert.YearAppenderRetriever">
            <sourceFileColumn originalName="Řada dokladů" argumentName="categoryType"/>
            <sourceFileColumn originalName="Evidenční číslo" argumentName="serialNumber"/>
        </retriever>

        <property name="recordType" value="INVOICE" onlyNewRecords="true"/>

        <property name="authorityRole" onlyNewRecords="true" value="CUSTOMER"/>

        <property name="authorityIdentifier" onlyNewRecords="true"
                  converterParameter="2018" converter="eu.profinit.opendata.transform.convert.YearAppenderIdentificationSetter">
            <sourceFileColumn originalName="Řada dokladů" argumentName="categoryCode"/>
            <sourceFileColumn originalName="Evidenční číslo" argumentName="serialNumber"/>
        </property>

        <property name="partner" onlyNewRecords="true"
                  converter="eu.profinit.opendata.transform.convert.PartnerSetter">
            <sourceFileColumn originalName="Název obchodního partnera" argumentName="name"/>
        </property>

        <property name="subject" onlyNewRecords="true" converter="eu.profinit.opendata.transform.convert.DirectStringSetter">
            <sourceFileColumn originalName="Předmět" argumentName="inputString"/>
        </property>

        <property name="currency" onlyNewRecords="true" value="CZK"/>

        <property name="allAmounts" onlyNewRecords="true" converter="eu.profinit.opendata.transform.convert.AllAmountSetter">
            <sourceFileColumn originalName="Celkem Kč" argumentName="inputAmount"/>
        </property>

        <property name="variableSymbol" onlyNewRecords="false" converter="eu.profinit.opendata.transform.convert.DirectStringSetter">
            <sourceFileColumn originalName="Variabilní symbol" argumentName="inputString"/>
        </property>

        <property name="dateCreated" required="false" onlyNewRecords="true" converter="eu.profinit.opendata.transform.convert.UniversalDateSetter">
            <sourceFileColumn originalName="Datum přijetí" argumentName="inputDateString"/>
        </property>

        <property name="dateOfPayment" required="false" onlyNewRecords="true" converter="eu.profinit.opendata.transform.convert.UniversalDateSetter">
            <sourceFileColumn originalName="Datum úhrady" argumentName="inputDateString"/>
        </property>

        <property name="masterId" onlyNewRecords="true" converter="eu.profinit.opendata.transform.convert.RandomMasterIdSetter"/>

    </mappedSheet>
</mapping>