<?xml version="1.0" encoding="utf-8" ?>
<mapping xmlns:xsi="http://www.w3.org/2001/XMLSchema-instance"
         xsi:noNamespaceSchemaLocation="../../xsd/datasource_mapping.xsd">

    <mappedSheet number="0">
        <headerRow>0</headerRow>

        <retriever className="eu.profinit.opendata.transform.convert.mmr.MMRInvoiceRetriever">
            <sourceFileColumn originalName="Osoba" argumentName="partnerName"/>
            <sourceFileColumn originalName="Částka" argumentName="amount"/>
            <sourceFileColumn originalName="Předmět fakturace" argumentName="subject"/>
        </retriever>

        <property name="recordType" value="INVOICE" onlyNewRecords="true"/>

        <property name="authorityRole" onlyNewRecords="true" value="CUSTOMER"/>

        <property name="authorityIdentifier" onlyNewRecords="true" converter="eu.profinit.opendata.transform.convert.SplitIdentifierSetter">
            <sourceFileColumn originalName="Dokladová řada" argumentName="categoryCode"/>
            <sourceFileColumn originalName="Číslo" argumentName="serialNumber"/>
        </property>

        <property name="partner" onlyNewRecords="true"
                  converter="eu.profinit.opendata.transform.convert.PartnerSetter">
            <sourceFileColumn originalName="Osoba" argumentName="name"/>
            <sourceFileColumn originalName="IČ" argumentName="ico"/>
        </property>

        <property name="subject" onlyNewRecords="true" converter="eu.profinit.opendata.transform.convert.DirectStringSetter">
            <sourceFileColumn originalName="Předmět fakturace" argumentName="inputString"/>
        </property>

        <property name="currency" onlyNewRecords="true" converter="eu.profinit.opendata.transform.convert.CurrencySetter">
             <sourceFileColumn originalName="Měna" argumentName="inputCurrencyCode"/>
        </property>

        <property name="allAmounts" onlyNewRecords="true" converter="eu.profinit.opendata.transform.convert.AllAmountSetter">
            <sourceFileColumn originalName="Částka" argumentName="inputAmount"/>
        </property>

        <property name="dateCreated" onlyNewRecords="true" converter="eu.profinit.opendata.transform.convert.CzechDateSetter">
            <sourceFileColumn originalName="Datum příchodu" argumentName="inputDateString"/>
        </property>

        <property name="dateOfPayment" onlyNewRecords="true" converter="eu.profinit.opendata.transform.convert.CzechDateSetter">
            <sourceFileColumn originalName="Datum úhrady" argumentName="inputDateString"/>
        </property>

        <property name="masterId" onlyNewRecords="true" converter="eu.profinit.opendata.transform.convert.RandomMasterIdSetter"/>

    </mappedSheet>
</mapping>