<?xml version="1.0" encoding="utf-8" ?>
<mapping xmlns:xsi="http://www.w3.org/2001/XMLSchema-instance"
         xsi:noNamespaceSchemaLocation="../../xsd/datasource_mapping.xsd">

    <mappedSheet number="0">
        <headerRow>3</headerRow>

        <retriever className="eu.profinit.opendata.transform.convert.PropertyBasedRecordRetriever">
            <sourceFileColumn originalName="Číslo smlouvy" argumentName="authorityIdentifier"/>
        </retriever>

        <property name="recordType" value="CONTRACT" onlyNewRecords="true"/>
        <property name="inEffect" value="true" onlyNewRecords="false"/>

        <property name="authorityRole" onlyNewRecords="true" converter="eu.profinit.opendata.transform.convert.mzp.MZPRoleSetter">
            <sourceFileColumn originalName="Povaha smlouvy" argumentName="inputRole"/>
        </property>

        <property name="authorityIdentifier" onlyNewRecords="true" converter="eu.profinit.opendata.transform.convert.DirectStringSetter">
            <sourceFileColumn originalName="Číslo smlouvy" argumentName="inputString"/>
        </property>

        <property name="partner" onlyNewRecords="true"
                  converter="eu.profinit.opendata.transform.convert.PartnerSetter">
            <sourceFileColumn originalName="Dodavatel" argumentName="name"/>
        </property>

        <property name="subject" onlyNewRecords="true" converter="eu.profinit.opendata.transform.convert.DirectStringSetter">
            <sourceFileColumn originalName="Předmět smlouvy" argumentName="inputString"/>
        </property>

        <property name="currency" onlyNewRecords="true" value="CZK"/>

        <property name="allAmounts" onlyNewRecords="true" converter="eu.profinit.opendata.transform.convert.mzp.MZPContractAmountSetter">
            <sourceFileColumn originalName="Celková částka" argumentName="inputAmount"/>
        </property>

        <property name="dateCreated" onlyNewRecords="true" converter="eu.profinit.opendata.transform.convert.mzp.MZPDateSetter">
            <sourceFileColumn originalName="Datum podpisu" argumentName="inputDate"/>
        </property>

        <property name="dateOfExpiry" onlyNewRecords="true" converter="eu.profinit.opendata.transform.convert.mzp.MZPDateSetter">
            <sourceFileColumn originalName="Datum ukončení smlouvy" argumentName="inputDate"/>
        </property>

        <property name="masterId" onlyNewRecords="true" converter="eu.profinit.opendata.transform.convert.RandomMasterIdSetter">

        </property>
    </mappedSheet>
</mapping>